{
  "cupkp_schema_version": "1.0",
  "frameworks": [],
  "competencies": [],
  "use_points": [],
  "knowledge_points": [],
  "competency_up_mappings": [],
  "up_kp_mappings": [],
  "kp_prerequisites": [],
  "learning_objects": [],
  "activity_mappings": [],
  "assessment_rules": [],
  "project_evidence": []
}
